{
  "environment": "localnet",
  "nativeNetwork": "kingpepe-regtest",
  "solanaCluster": "localnet",
  "attestation": {
    "attesterAKeyRef": "${ATTESTER_A_KEY_REF}",
    "attesterBKeyRef": "${ATTESTER_B_KEY_REF}"
  },
  "program": {
    "bridgeProgramId": "PLACEHOLDER_BRIDGE_PROGRAM_ID",
    "transceiverProgramId": "PLACEHOLDER_TRANSCIEVER_PROGRAM_ID",
    "mint": "PLACEHOLDER_MINT_ADDRESS",
    "tokenProgram": "TokenkegQfeZyiNwAJbNbGKPFXCWuBvf9Ss623VQ5DA"
  },
  "architecture": "ONE_WAY_AUTOMATIC_BURN_AND_MINT",
  "burn": {
    "custodyModel": "SINGLE_KEY_ACCEPTED_RISK",
    "keyReference": "PROTECTED_SERVER_SIDE_ONLY",
    "nativeDepositConfirmations": 12,
    "nativeBurnConfirmations": 12,
    "feeFunding": "SEPARATE_OPERATIONAL_INPUTS",
    "bridgeFeeAtomic": "0"
  }
}
